{
	"$schema": "https://raw.githubusercontent.com/input-output-hk/hermes/main/hermes/schemas/hermes_module_manifest.schema.json",
	"name": "rbac_registration_indexer",
	"metadata": "metadata.json",
	"component": "rbac_registration_indexer.wasm",
	"config": {
		"file": "config.json",
		"schema": "config.schema.json"
	},
	"settings": {
		"schema": "settings.schema.json"
	}
}
