{
    "$schema": "https://raw.githubusercontent.com/input-output-hk/hermes/main/hermes/schemas/hermes_module_manifest.schema.json",
    "name": "module",
    "metadata": "file://modules/counter/counter_metadata.json",
    "component": "file://counter.wasm",
    "config": {
        "file": "file://modules/counter/config.json",
        "schema": "file://modules/counter/config.schema.json"
    },
    "settings": {
        "schema": "file://modules/counter/settings.schema.json"
    },
    "share": "file://modules/counter/share"
}