{
  "$schema": "https://raw.githubusercontent.com/input-output-hk/hermes/main/hermes/schemas/hermes_module_manifest.schema.json",
  "name": "gateway",
  "metadata": "metadata.json",
  "component": "gateway.wasm",
  "config": {
    "file": "config.json",
    "schema": "config.schema.json"
  },
  "settings": {
    "schema": "settings.schema.json"
  }
}
